{
  "$schema": "http://json-schema.org/draft-07/schema#",
  "title": "AI Agent Evaluation Scenario",
  "type": "object",
  "required": ["scenario_id", "title", "description", "use_case", "core_function", "industry", "tasks"],
  "properties": {
    "scenario_id": {
      "type": "string",
      "description": "Unique identifier for the scenario"
    },
    "title": {
      "type": "string",
      "description": "Title of the scenario"
    },
    "description": {
      "type": "string",
      "description": "Background context for the scenario"
    },
    "instructions": {
      "type": "string",
      "description": "Prompt or instructions to be sent to the agent"
    },
    "expected_response": {
      "type": "string",
      "description": "Ideal or expected response from the agent"
    },
    "use_case": {
      "type": "string",
      "description": "The use case for which the agent is being evaluated (e.g., customer support, data analysis)"
    },
    "core_function": {
      "type": "string",
      "description": "The core function in the industry that the use case belongs to (e.g., customer service, sales, technical support)"
    },
    "industry": {
      "type": "string",
      "description": "Industry tag (e.g. telecom, finance)"
    },
    "tasks": {  
        "type": "array",
        "description": "List of tasks the agent is expected to perform",
        "items": {
            "type": "object",
            "required": ["task_id", "description", "expected_outcome", "success_criteria"],
            "properties": { 
                "task_id": {
                    "type": "string",
                    "description": "Unique identifier for the task"
                },
                "description": {
                    "type": "string",
                    "description": "Background context for the task"
                },
                "expected_outcome": {
                    "type": "string",
                    "description": "Ideal or expected response from the agent"
                },
                "required_tools": {
                    "type": "array",
                    "items": { "type": "string" },
                    "description": "List of tools the agent is expected to use"
                },
                "success_criteria": 
                { 
                    "type": "array",
                    "items": 
                    {
                        "type": "object",
                        "required": ["metric", "threshold"],
                        "properties": 
                        { 
                            "metric": {
                                "type": "string",
                                "description": "The metric to be tested for the task"
                            },
                            "threshold": {
                                "type": "number",
                                "description": "The threshold for the metric to be considered successful"
                            }
                        }
                    },
                    "description": "Criteria to determine if the task was successfully completed"
                }
            }
        }
    },
    "tools_required": {
      "type": "array",
      "items": { "type": "string" },
      "description": "List of tools the agent is expected to use"
    },
    "complexity_level": {
      "type": "string",
      "enum": ["low", "medium", "high"],
      "description": "Relative difficulty of the scenario"
    },
    "author": {
      "type": "string",
      "description": "Contributor of the scenario"
    },
    "version": {
      "type": "string",
      "pattern": "^\\d+\\.\\d+(\\.\\d+)?$",
      "description": "Semantic version (e.g., 1.0 or 2.1.3)"
    }
  }
}