{
  "scenario_id": "media-bo-12258",
  "title": "Create Highlight Clips from a Live Stream",
  "description": "During a live gaming stream, a community manager needs to create highlight clips of exciting moments to share on social media.",
  "use_case": "Broadcasting & Streaming Operations",
  "core_function": "Live Event Broadcasting",
  "industry": "Media and Entertainment",
  "tasks": [
    {
      "task_id": "task-1",
      "description": "Identify a key moment in the live stream (e.g., a game-winning play).",
      "expected_outcome": "Agent notes the timestamp of the highlight.",
      "required_tools": [],
      "success_criteria": [
        {
          "metric": "decision_making_accuracy",
          "threshold": 1.0
        }
      ]
    },
    {
      "task_id": "task-2",
      "description": "Use a clipping tool to create a 30-second video clip of the moment from the live feed.",
      "expected_outcome": "Agent successfully generates the video clip.",
      "required_tools": [
        "create_stream_clip"
      ],
      "success_criteria": [
        {
          "metric": "tool_call_correctness",
          "threshold": 1.0
        }
      ]
    },
    {
      "task_id": "task-3",
      "description": "Post the video clip to the company's Twitter and TikTok accounts with a relevant caption.",
      "expected_outcome": "Agent successfully shares the highlight on social media.",
      "required_tools": [
        "post_to_social_media"
      ],
      "success_criteria": [
        {
          "metric": "process_adherence",
          "threshold": 1.0
        }
      ]
    }
  ]
}