{
  "scenario_id": "realestate-com-13249",
  "title": "Calculate Building Load Factor",
  "description": "A landlord needs to calculate the building's load factor to accurately bill tenants for their share of common areas.",
  "use_case": "Commercial Real Estate",
  "core_function": "Property & Asset Management",
  "industry": "Real Estate",
  "tasks": [
    {
      "task_id": "task-1",
      "description": "Find the total rentable square footage (RSF) of the building.",
      "expected_outcome": "Agent retrieves the building's total RSF.",
      "required_tools": [
        "get_building_specs"
      ],
      "success_criteria": [
        {
          "metric": "information_retrieval_accuracy",
          "threshold": 1.0
        }
      ]
    },
    {
      "task_id": "task-2",
      "description": "Find the total usable square footage (USF) by summing the square footage of all tenant-exclusive spaces.",
      "expected_outcome": "Agent calculates the total USF from the rent roll.",
      "required_tools": [
        "get_rent_roll"
      ],
      "success_criteria": [
        {
          "metric": "calculation_accuracy",
          "threshold": 1.0
        }
      ]
    },
    {
      "task_id": "task-3",
      "description": "Calculate the load factor by dividing the RSF by the USF.",
      "expected_outcome": "Agent correctly calculates the load factor (e.g., 1.15 for a 15% load factor).",
      "required_tools": [
        "calculate_load_factor"
      ],
      "success_criteria": [
        {
          "metric": "calculation_accuracy",
          "threshold": 1.0
        }
      ]
    }
  ]
}