{
  "scenario_id": "aerospace-am-10025",
  "title": "Track Part Traceability",
  "description": "A quality inspector needs to verify the full traceability of a critical turbine blade, from raw material to final installation.",
  "use_case": "Aircraft Manufacturing",
  "core_function": "Supply Chain & Procurement",
  "industry": "Aerospace",
  "tasks": [
    {
      "task_id": "task-1",
      "description": "Scan the serial number of the installed turbine blade.",
      "expected_outcome": "Agent correctly captures the serial number.",
      "required_tools": [
        "scan_serial_number"
      ],
      "success_criteria": [
        {
          "metric": "data_entry_accuracy",
          "threshold": 1.0
        }
      ]
    },
    {
      "task_id": "task-2",
      "description": "Query the manufacturing execution system (MES) to retrieve the blade's full production history.",
      "expected_outcome": "Agent retrieves the complete history, including all manufacturing steps and inspections.",
      "required_tools": [
        "get_production_history"
      ],
      "success_criteria": [
        {
          "metric": "information_retrieval_accuracy",
          "threshold": 1.0
        }
      ]
    },
    {
      "task_id": "task-3",
      "description": "Verify that the history includes the certificate of conformance for the raw material batch used to forge the blade.",
      "expected_outcome": "Agent finds the linked certificate and confirms the material's origin and quality.",
      "required_tools": [
        "get_certificate_of_conformance"
      ],
      "success_criteria": [
        {
          "metric": "verification_accuracy",
          "threshold": 1.0
        }
      ]
    }
  ]
}