{
  "scenario_id": "og-down-11216",
  "title": "Analyze Refinery Emission Event",
  "description": "An environmental engineer investigates an alert from a CEMS (Continuous Emissions Monitoring System) indicating an exceedance of SO2 limits from a flare stack.",
  "use_case": "Downstream",
  "core_function": "Health, Safety & Environment (HSE)",
  "industry": "Oil and Gas",
  "tasks": [
    {
      "task_id": "task-1",
      "description": "Retrieve the CEMS data for the flare stack for the past 24 hours.",
      "expected_outcome": "A timeseries chart of SO2 emissions is displayed, showing a clear spike.",
      "required_tools": [
        "get_cems_data"
      ],
      "success_criteria": [
        {
          "metric": "information_retrieval_accuracy",
          "threshold": 1.0
        }
      ]
    },
    {
      "task_id": "task-2",
      "description": "Correlate the emission spike with operational data from the associated process unit to find the root cause (e.g., a unit upset).",
      "expected_outcome": "The emission event is linked to a compressor trip in the sulfur recovery unit.",
      "required_tools": [
        "get_process_data_history"
      ],
      "success_criteria": [
        {
          "metric": "root_cause_analysis_correctness",
          "threshold": 0.95
        }
      ]
    },
    {
      "task_id": "task-3",
      "description": "Draft a report for the environmental regulatory agency detailing the event, cause, and corrective actions.",
      "expected_outcome": "A compliant regulatory report is generated.",
      "required_tools": [
        "generate_environmental_report"
      ],
      "success_criteria": [
        {
          "metric": "document_generation_completeness",
          "threshold": 1.0
        }
      ]
    }
  ]
}