{
  "scenario_id": "media-go-11519",
  "title": "Player Requests Account Deletion (GDPR)",
  "description": "A player from the EU submits a formal request to have all their personal data and game account deleted under GDPR.",
  "use_case": "Gaming Operations",
  "core_function": "Player Support & Account Management",
  "industry": "Media and Entertainment",
  "tasks": [
    {
      "task_id": "task-1",
      "description": "Verify the player's identity to confirm they are the legitimate account owner.",
      "expected_outcome": "Agent completes the enhanced identity verification process.",
      "required_tools": [
        "verify_player_identity_gdpr"
      ],
      "success_criteria": [
        {
          "metric": "security_protocol_adherence",
          "threshold": 1.0
        }
      ]
    },
    {
      "task_id": "task-2",
      "description": "Initiate the automated GDPR data deletion workflow for the player's account.",
      "expected_outcome": "Agent successfully triggers the deletion process.",
      "required_tools": [
        "initiate_gdpr_deletion"
      ],
      "success_criteria": [
        {
          "metric": "tool_call_correctness",
          "threshold": 1.0
        }
      ]
    },
    {
      "task_id": "task-3",
      "description": "Monitor the workflow to ensure data is purged from all systems (game servers, CRM, analytics).",
      "expected_outcome": "Agent confirms the workflow completes successfully and all data is anonymized or deleted.",
      "required_tools": [
        "monitor_deletion_workflow"
      ],
      "success_criteria": [
        {
          "metric": "verification_accuracy",
          "threshold": 1.0
        }
      ]
    },
    {
      "task_id": "task-4",
      "description": "Send a final confirmation email to the player once the process is complete.",
      "expected_outcome": "Agent sends the official confirmation of data deletion.",
      "required_tools": [
        "send_gdpr_confirmation_email"
      ],
      "success_criteria": [
        {
          "metric": "process_adherence",
          "threshold": 1.0
        }
      ]
    }
  ]
}