{
  "scenario_id": "legal-ldr-11118",
  "title": "Prepare a Deposition Summary",
  "description": "A junior associate needs to read a 200-page deposition transcript and prepare a summary for the lead attorney.",
  "use_case": "Litigation & Dispute Resolution",
  "core_function": "Discovery & E-Discovery",
  "industry": "Legal",
  "tasks": [
    {
      "task_id": "task-1",
      "description": "Ingest the deposition transcript.",
      "expected_outcome": "Agent has the full text of the transcript.",
      "required_tools": [
        "document_parsing_tool"
      ],
      "success_criteria": [
        {
          "metric": "information_extraction_accuracy",
          "threshold": 1.0
        }
      ]
    },
    {
      "task_id": "task-2",
      "description": "Identify and extract key testimony related to the central themes of the case.",
      "expected_outcome": "Agent pulls out the most important questions and answers.",
      "required_tools": [],
      "success_criteria": [
        {
          "metric": "legal_analysis_correctness",
          "threshold": 1.0
        }
      ]
    },
    {
      "task_id": "task-3",
      "description": "Create a chronological or topic-based summary of the testimony, including page and line numbers for key admissions.",
      "expected_outcome": "Agent produces a well-organized, accurate summary that is easy to navigate.",
      "required_tools": [
        "document_drafting_tool"
      ],
      "success_criteria": [
        {
          "metric": "writing_quality",
          "threshold": 1.0
        }
      ]
    }
  ]
}