{
  "scenario_id": "realestate-tc-13146",
  "title": "Confirm Lender's Loan Commitment",
  "description": "The financing contingency deadline is approaching. The TC must confirm the buyer has secured their loan commitment from the lender.",
  "use_case": "Residential & Commercial Sales",
  "core_function": "Transaction Coordination",
  "industry": "Real Estate",
  "tasks": [
    {
      "task_id": "task-1",
      "description": "Check the transaction file for the financing contingency deadline.",
      "expected_outcome": "Agent identifies the deadline is in 2 days.",
      "required_tools": [
        "get_transaction_checklist"
      ],
      "success_criteria": [
        {
          "metric": "information_retrieval_accuracy",
          "threshold": 1.0
        }
      ]
    },
    {
      "task_id": "task-2",
      "description": "Contact the buyer's loan officer to request the status and a copy of the loan commitment letter.",
      "expected_outcome": "Agent sends a request email to the loan officer.",
      "required_tools": [
        "send_email"
      ],
      "success_criteria": [
        {
          "metric": "communication_clarity",
          "threshold": 1.0
        }
      ]
    },
    {
      "task_id": "task-3",
      "description": "Upon receipt, upload the commitment letter to the transaction file and mark the contingency as satisfied.",
      "expected_outcome": "The letter is saved, and the transaction checklist is updated.",
      "required_tools": [
        "upload_transaction_document",
        "update_transaction_checklist"
      ],
      "success_criteria": [
        {
          "metric": "process_adherence",
          "threshold": 1.0
        }
      ]
    }
  ]
}