{
  "scenario_id": "energy-tr-11157",
  "title": "Financial Transmission Right (FTR) Auction",
  "description": "A trading firm wants to participate in an FTR auction to hedge against congestion costs for its power plant.",
  "use_case": "Energy Trading & Portfolio Management",
  "core_function": "Trade Execution & Hedging",
  "industry": "Energy",
  "tasks": [
    {
      "task_id": "task-1",
      "description": "Analyze historical congestion patterns and costs on the transmission path from the power plant to the main load center.",
      "expected_outcome": "Agent identifies that the path is frequently congested during summer months.",
      "required_tools": [
        "get_historical_congestion_data"
      ],
      "success_criteria": [
        {
          "metric": "data_analysis_accuracy",
          "threshold": 0.95
        }
      ]
    },
    {
      "task_id": "task-2",
      "description": "Forecast the likely clearing price for the FTR in the upcoming auction based on historical auction results.",
      "expected_outcome": "Agent provides an estimated price for the FTR.",
      "required_tools": [
        "forecast_ftr_auction_price"
      ],
      "success_criteria": [
        {
          "metric": "forecast_accuracy_mae",
          "threshold": 10.0
        }
      ]
    },
    {
      "task_id": "task-3",
      "description": "Develop a bidding strategy and submit a bid for the required amount of FTRs into the ISO's auction system.",
      "expected_outcome": "Agent successfully submits the bid.",
      "required_tools": [
        "submit_ftr_auction_bid"
      ],
      "success_criteria": [
        {
          "metric": "tool_call_correctness",
          "threshold": 1.0
        }
      ]
    }
  ]
}